<xs:schema xmlns:xs="http://www.example.com/2025/XML.Schema">
<xs:element name="employees">
    <xs:complexType>
       <xs:element name="employee">
          <xs:complexType>
             <xs:sequence>
                <xs:element name="name" type="xs:string"/>
                <xs:element name="age" type="xs:integer"/>
                <xs:element name="gender" type="xs:string"/>
                <xs:element name="email" type="xs:string"/>
                <xs:element name="phone" type="xs:string"/>
                <xs:element name="address" type="xs:string"/>
             </xs:sequence>
          </xs:complexType>
       </xs:element>
    </xs:complexType>
</xs:element>
</xs:schema>